,id,title,category_id,views,likes,favorites,comments,date,duration,tags,views_scaled,likes_scaled,update_diff,time_gap_minutes,view_per_minutes,vpm_scaled
0,TkuIh1B-RCE,Our 50 State Camper Van Road Trip BEGINS!! First State: Oklahoma!   RV Life USA,19,120990,7856,0,,2022-06-25 14:51:59+00:00,1104,"['The Endless Adventure', 'Eric Bieller', 'Allison Bieller', 'rv', 'rv vlog', 'rv travel', 'full time rv', 'camper van', 'van life', 'rv life', 'the endless adventure rv', 'vintage rv', 'oklahoma']",-0.09306483655409066,0.033699976597238473,0.0,437428.2761394834,0.27659391630508073,-0.8422024308414647
1,VQCHsbb_NGk,We Stayed at Arkansas’ HIGHEST RATED RV Camp Site! + Exploring Eureka Springs 😍   RV Life USA,19,126143,7967,0,,2022-07-02 15:26:41+00:00,932,"['The Endless Adventure', 'Eric Bieller', 'Allison Bieller', 'rv', 'rv life', 'van life', 'rv renovation', 'vintage rv', 'arkansas', 'highest rated rv park', 'arkansas best rv park', 'rv camping', 'camping']",0.0,0.08565410718464779,168.57833333333335,427313.57613948337,0.29520007564380424,-0.7932219686135137
2,RMYE1gNZQdk,A Day in Our Life Living FULL TIME in a Vintage Camper Van!   RV Life USA,19,147342,7841,0,,2022-07-09 18:09:26+00:00,1110,"['The Endless Adventure', 'Eric Bieller', 'Allison Bieller', 'rv life', 'camper van', 'vintage rv', 'full time rv', 'the endless adventure rv', 'van life']",0.3828607549214376,0.026679148139480458,170.7125,417070.82613948337,0.3532781263169042,-0.6403322875418069
3,X6ibhSbz-wg,Our First Time RV Camping In a PARKING LOT! Creepy Door Knocks & More Engine Trouble 😱,19,1024570,20021,0,,2022-07-21 17:58:18+00:00,1359,"['The Endless Adventure', 'Eric Bieller', 'Allison Bieller', 'rv', 'rv camping', 'rv camping parking lot', 'overnight rv camping', 'rv life', 'endless adventure rv', 'can life', 'camper van', 'rv vlog']",16.225880440671844,5.727591855838989,287.81444444444446,399801.95947281667,2.562693793074475,5.175924503629304
4,Vu24oHbAfCA,We Traded Our 1976 Vintage Camper Van for a 2020 RV!   How Do They Compare??,19,390905,12694,0,,2022-07-28 17:15:51+00:00,1310,"['The Endless Adventure', 'Eric Bieller', 'Allison Bieller', 'rv', 'rv life', 'rv comparison', 'camper van', 'van life', 'the endless adventure rv']",4.7816868340256455,2.298151181839457,167.2925,389764.4094728167,1.0029263588451445,1.0698578777428709
5,1_GGBMN5vIs,The ULTIMATE Camper Van Tour of KANSAS! Epic State Guide + Incredible Local Food!   RV Life USA,19,128836,7586,0,,2022-08-04 17:18:46+00:00,1484,"['The Endless Adventure', 'Eric Bieller', 'Allison Bieller', 'rv life', 'kansas', 'things to do in kansas', 'kansas guide', 'the endless adventure rv', 'camper van']",0.04863644572873397,-0.09267493564240581,168.04861111111111,379681.49280615,0.3393265208893878,-0.6770596996971746
6,FO8EQ6N7uag,Is This the End of RV Life?? - Back to Our Vintage Camper... But We Have a HUGE Problem! 😭,19,156913,9007,0,,2022-08-12 18:25:21+00:00,946,"['The Endless Adventure', 'Eric Bieller', 'Allison Bieller', 'rv', 'rv life', 'the endless adventure rv', 'clementine rv', 'rv living', 'rv mistake']",0.5557160917464331,0.5724315469225368,193.10972222222222,368094.9094728167,0.42628408044199756,-0.4481451030003149
7,sD3kxdj56us,Full Tour of Our LUXURY Off-Road Travel Trailer RV!,19,206455,10122,0,,2022-08-29 17:40:48+00:00,1668,"['The Endless Adventure', 'Eric Bieller', 'Allison Bieller', 'rv', 'luxury rv', 'blackseries', 'the endless adventure rv', 'travel trailer', 'tiny home', 'rv life']",1.45046053819758,1.094313128949216,407.2575,343659.45947281667,0.6007545967647968,0.01114616603953524
8,EAotmOmwv0c,Our Brand New RV Setup BROKE DOWN!? Are We Cursed??,19,176995,10556,0,,2022-09-05 15:20:45+00:00,1007,"['The Endless Adventure', 'Eric Bieller', 'Allison Bieller', 'rv', 'rv life', 'the endless adventure rv', 'travel trailer', 'black series', 'rv breakdown']",0.918403467581723,1.2974490989936813,165.66583333333332,333719.50947281666,0.5303705506447691,-0.17413888122207188
9,aK7zlYAa7BA,Our PERFECT RV Road Trip Across Michigan’s Upper Peninsula 😍 - The Ultimate Guide,19,203033,9893,0,,2022-09-12 18:59:31+00:00,1501,"['The Endless Adventure', 'Eric Bieller', 'Allison Bieller', 'michigan', 'rv', 'rv life', 'the endless adventure rv', 'michigan guide', 'things to do in michigan']",1.3886581181145023,0.987128481160777,171.6461111111111,323420.74280615,0.6277674036562729,0.0822570139868179
10,aytNOU7IbKU,Overnight RV Camping at a WALMART Parking Lot! - Super Sketchy 👀,19,295266,9945,0,,2022-09-19 14:41:53+00:00,1114,"['The Endless Adventure', 'Eric Bieller', 'Allison Bieller', 'rv', 'rv camping', 'rv parking lot', 'rv walmart', 'the endless adventure rv']",3.054415748600325,1.0114673531476714,163.7061111111111,313598.37613948336,0.9415418652189403,0.9082640304203495
11,xk7jt8H-rBY,We Traded Our 2022 Travel Trailer for a VINTAGE CAMPER VAN!   RV Swap with Travel Beans!,19,158612,7555,0,,2022-09-26 15:01:16+00:00,1156,"['The Endless Adventure', 'Eric Bieller', 'Allison Bieller', 'travel beans', 'rv', 'the endless adventure rv', 'camper van', 'camper van swap']",0.5864005779302872,-0.10718464778843903,168.32305555555556,303498.99280615,0.5226112895251294,-0.19456503093241817
12,6wMyGoTSpFo,We Had to Break Into OUR OWN RV! 😫 + Update on the Future of Clementine!,19,114760,7232,0,,2022-10-04 15:07:15+00:00,1014,"['The Endless Adventure', 'Eric Bieller', 'Allison Bieller', 'rv', 'travel trailer', 'the endless adventure rv', 'clementine', 'camper van']",-0.20558063933538018,-0.258366487245495,192.09972222222223,291973.00947281666,0.39305002954625645,-0.5356332914515876
13,Ajz5OfAi4_M,We’re Back to FULL-TIME RV Life! - Traveling to Our 8th US State: Indiana!,19,137998,7576,0,,2022-10-24 14:01:46+00:00,1220,"['The Endless Adventure', 'Eric Bieller', 'Allison Bieller', 'rv', 'rv life', 'travel trailer', 'indiana', 'the endless adventure rv']",0.21410511107097707,-0.09735548794757781,478.9086111111111,263238.49280615,0.5242318421174913,-0.19029894820177132
14,G8wuD2_z2R8,How We RV Camp FOR FREE At Wineries & Farms! - Best Off-Grid Boondocking in Ohio 😍,19,90153,6432,0,,2022-10-30 19:32:05+00:00,1050,"['The Endless Adventure', 'Eric Bieller', 'Allison Bieller', 'rv camping', 'free rv camping', 'rv boondocking', 'rv camping for free']",-0.6499909698392632,-0.6328106716592558,149.5052777777778,254268.17613948332,0.3545587236624727,-0.6369611323897981
15,Cp3K8FuN5wI,New York is INCREDIBLE! - Perfect Fall Colors RV Road Trip in The Finger Lakes 🍁,19,97676,6433,0,,2022-11-07 15:30:23+00:00,1005,"['The Endless Adventure', 'Eric Bieller', 'Allison Bieller', 'rv', 'new york', 'the endless adventure rv', 'new york guide', 'finger lakes', 'upstate new york']",-0.5141231713924508,-0.6323426164287386,187.97166666666666,242989.87613948333,0.4019755948347869,-0.5121368618274409
16,12bvCbmwujA,Our ULTIMATE Road Trip in New York’s HUDSON VALLEY! Epic Guide + Delicious Local Food!   RV Life USA,19,112179,6766,0,,2022-11-11 18:56:07+00:00,1466,"['The Endless Adventure', 'Eric Bieller', 'Allison Bieller', 'hudson valley', 'hudson valley guide', 'new york', 'new york guide', 'new york rv', 'the endless adventure new york', 'new york road trip', 'top things to do in hudson valley']",-0.25219432905905725,-0.47648022466651063,99.42888888888889,237024.14280615,0.4732809015651435,-0.3244266084980558
17,iKjP9P_0LmU,Overnight RV Camping in a Cracker Barrel PARKING LOT! - We’re Locked Out AGAIN!?,19,167132,8123,0,,2022-11-14 16:28:25+00:00,949,"['The Endless Adventure', 'Eric Bieller', 'Allison Bieller', 'parking lot', 'rv camping', 'rv camping at cracker barrel', 'rv camping at walmart']",0.7402745168864006,0.15867072314533115,69.53833333333333,232851.84280615,0.7177611222048089,0.31916425808127974
18,HoUkA_2PP4E,Our Crazy RV Road Trip Continues To VERMONT & NEW HAMPSHIRE!,19,115431,6468,0,,2022-11-21 15:19:54+00:00,1342,"['The Endless Adventure', 'Eric Bieller', 'Allison Bieller', 'rv', 'rv camping', 'rv road trip', 'the endless adventure rv', 'vermont', 'new hampshire']",-0.19346216362651256,-0.6159606833606366,166.85805555555555,222840.35947281666,0.5179986258911099,-0.20670780541818337
19,Q7aikVSo7o0,Full Tour of Our Renovated Luxury TINY HOUSE in Maine! - Crazy Before & After 😍,19,114370,7456,0,,2022-11-26 17:37:35+00:00,931,"['The Endless Adventure', 'Eric Bieller', 'Allison Bieller', 'tiny home', 'tiny house', 'the endless adventure tiny house', 'tiny house tour', 'luxury', 'luxury tiny house']",-0.21262416471013185,-0.15352211560964193,122.29472222222222,215502.67613948332,0.5307126670017519,-0.173238264550157
20,LirXGX_V5Us,We’re Vanlifers Now!? - Trading Our Travel Trailer for a 1987 VW CAMPER VAN! (Maine),19,115074,7028,0,,2022-12-02 16:23:12+00:00,1211,"['The Endless Adventure', 'Eric Bieller', 'Allison Bieller', 'camper van', 'vw bus', 'westfalia', 'camper van tour', 'vw van tour', 'the endless adventure rv', 'vintage camper van']",-0.1999096983926314,-0.35384975427100396,142.7602777777778,206937.05947281665,0.556082126097458,-0.10645350739747367
21,1UrydDBItwk,Winter Vanlife is TOUGH! - Exploring Maine in Below Freezing Temperatures 🥶,19,122921,7131,0,,2022-12-06 20:29:07+00:00,1188,"['The Endless Adventure', 'Eric Bieller', 'Allison Bieller', 'camper van', 'vw bus', 'vw van', 'westfalia', 'rv', 'endless adventure rv']",-0.05819035578833303,-0.30564006552773226,100.09861111111111,200931.14280615,0.6117568351193278,0.04010940935786258
22,aeUxGn3c2q8,What’s Going On With Our VINTAGE RV?? Huge Update + An Animal Broke In!,19,117358,7784,0,,2022-12-09 18:22:41+00:00,1079,"['The Endless Adventure', 'Eric Bieller', 'Allison Bieller', 'rv renovation', 'rv living', 'full time rv', 'the endless adventure rv', 'vintage rv', 'clementine rv']",-0.1586599241466498,0.0,69.89277777777778,196737.5761394833,0.5965205137873374,0.0
23,1UNths0W7d0,Should We Quit RV Life?? - Our Thoughts After 4 Months Living FULL-TIME!,19,117366,7103,0,,2022-12-16 18:27:26+00:00,1303,"['The Endless Adventure', 'Eric Bieller', 'Allison Bieller', 'Mens jeans', 'mens pants', 'DUER', 'comfortable jeans', 'stretchy jeans', 'rv', 'rv life', 'full-time rv', 'the endless adventure rv', 'camper van', 'rv lifestyle', 'rv living', 'full time rving', 'full time rv']",-0.15851544157486003,-0.3187456119822139,168.07916666666668,186652.8261394833,0.6287930508606061,0.08495701634821289
24,EIIel-d4sZk,Traveling by RV to 4 STATES IN 4 DAYS!? - Everything to SEE and EAT in New England!,19,109223,6636,0,,2022-12-19 18:02:44+00:00,1351,"['The Endless Adventure', 'Eric Bieller', 'Allison Bieller', 'rv', 'rv life', 'new england', 'new england road trip', 'best new england states', 'what to do in new england', 'massachusetts', 'rhode island', 'Connecticut']",-0.30558063933538016,-0.5373274046337467,71.58833333333334,182357.52613948332,0.598949779108412,0.006395008025806115
25,FwMHCjmiXN4,Our PERFECT Day in Philadelphia! Cheesesteak SHOWDOWN  Delicious Local Food Tour & More! 🤤,19,116844,6774,0,,2022-12-27 18:04:42+00:00,1003,"['The Endless Adventure', 'Eric Bieller', 'Allison Bieller', 'philadelphia', 'philadelphia guide', 'things to do in philadelphia', 'philadelphia foods', 'what to eat in philadelphia', 'Philadelphia food tour', 'Philadelphia guide', 'philly cheesesteak']",-0.16794292938414304,-0.47273578282237305,192.03277777777777,170835.55947281665,0.6839559653772914,0.2301726410067063
26,A8CuWbVqU8w,First Time RV Camping at a Rest Stop Parking Lot! - Electrical Issues And a Horrible Nights Sleep 😭,19,240427,8798,0,,2023-01-02 17:52:31+00:00,870,"['The Endless Adventure', 'Eric Bieller', 'Allison Bieller', 'rv', 'parking lot', 'parking lot camping', 'rv boondocking', 'rv rest stop']",2.0640057793028714,0.47460800374444184,143.79694444444445,162207.74280615,1.4822165442948534,2.331582793523243
27,tIg6mStZiP8,We FINALLY Got Our Vintage Camper Van Back! - But Does It Actually Run??,19,168359,9559,0,,2023-03-13 17:28:00+00:00,1209,"['The Endless Adventure', 'Eric Bieller', 'Allison Bieller', 'rv life', 'the endless adventure rv', 'rv renovation']",0.7624345313346578,0.8307980341680318,1679.5913888888888,61432.25947281667,2.7405633692261904,5.644163751589998
28,nhmc0yUjwVw,Are We Renovating Our RV AGAIN?? - Making Some MUCH NEEDED Improvements!,19,96414,7821,0,,2023-03-19 19:31:40+00:00,976,"['The Endless Adventure', 'Eric Bieller', 'Allison Bieller', 'rv', 'camper van', 'rv renovation', 'renovation', 'custom rv', 'the endless adventure rv']",-0.5369152970922882,0.017318043529136438,146.0611111111111,52668.59280615,1.8305786212070951,3.2486412384833963
29,qNrE6ZTpN3s,It’s Happening 😱 We’re Back to FULL-TIME RV Life! - Moving Back Into Our Vintage Camper Van!,19,172215,9500,0,,2023-04-08 14:43:21+00:00,1207,"['The Endless Adventure', 'Allison Bieller', 'rv life', 'vintage rv', 'camper van', 'van life', 'vintage rv renovation', 'rv living', 'rv', 'rv living full time']",0.8320751309373307,0.8031827755675169,475.1947222222222,24156.909472816667,7.129016242487079,17.196706449133337
30,TUMCF8Exrpw,Our RV is BACK IN THE SHOP!? - Upgrading Our Camper Van’s Leaky Propane Tank! 🔥😳,19,107022,7646,0,,2023-04-15 15:56:06+00:00,829,"['The Endless Adventure', 'Eric Bieller', 'Allison Bieller', 'rv', 'camper van', 'rv life', 'rv living', 'full time rv', 'van life', 'rv camping']",-0.3453314068990428,-0.06459162181137375,169.2125,14004.159472816666,7.64215804652463,18.547545291942484
