,id,title,category_id,views,likes,favorites,comments,date,date_gap_hours,duration,tags,views_scaled,likes_scaled,update_diff,time_gap_minutes,view_per_minutes,vpm_scaled
0,TkuIh1B-RCE,Our 50 State Camper Van Road Trip BEGINS!! First State: Oklahoma!   RV Life USA,19,120636,7843,0,,2022-06-25 14:51:59+00:00,418804.68,1104,"['The Endless Adventure', 'Eric Bieller', 'Allison Bieller', 'rv', 'rv vlog', 'rv travel', 'full time rv', 'camper van', 'van life', 'rv life', 'the endless adventure rv', 'vintage rv', 'oklahoma']",-0.1265177995397252,0.03780207911435129,0.0,437428.27547254995,0.2757846411955834,-1.1061605955610823
1,VQCHsbb_NGk,We Stayed at Arkansas’ HIGHEST RATED RV Camp Site! + Exploring Eureka Springs 😍   RV Life USA,19,125870,7958,0,,2022-07-02 15:26:41+00:00,408689.98,932,"['The Endless Adventure', 'Eric Bieller', 'Allison Bieller', 'rv', 'rv life', 'van life', 'rv renovation', 'vintage rv', 'arkansas', 'highest rated rv park', 'arkansas best rv park', 'rv camping', 'camping']",-0.025719540495517616,0.09990549480221413,168.57833333333335,427313.57547254994,0.29456120101217265,-1.0366973082504618
2,RMYE1gNZQdk,A Day in Our Life Living FULL TIME in a Vintage Camper Van!   RV Life USA,19,147084,7834,0,,2022-07-09 18:09:26+00:00,398447.23,1110,"['The Endless Adventure', 'Eric Bieller', 'Allison Bieller', 'rv life', 'camper van', 'vintage rv', 'full time rv', 'the endless adventure rv', 'van life']",0.38282731991025604,0.03294181179964898,170.7125,417070.82547254994,0.3526595269121276,-0.8217643948906324
3,X6ibhSbz-wg,Our First Time RV Camping In a PARKING LOT! Creepy Door Knocks & More Engine Trouble 😱,19,1023100,20001,0,,2022-07-21 17:58:18+00:00,381178.37,1359,"['The Endless Adventure', 'Eric Bieller', 'Allison Bieller', 'rv', 'rv camping', 'rv camping parking lot', 'overnight rv camping', 'rv life', 'endless adventure rv', 'can life', 'camper van', 'rv vlog']",17.25345928301124,6.6034831915755365,287.81444444444446,399801.9588058833,2.5590169769446978,7.340584989586767
4,Vu24oHbAfCA,We Traded Our 1976 Vintage Camper Van for a 2020 RV!   How Do They Compare??,19,390053,12677,0,,2022-07-28 17:15:51+00:00,371140.83,1310,"['The Endless Adventure', 'Eric Bieller', 'Allison Bieller', 'rv', 'rv life', 'rv comparison', 'camper van', 'van life', 'the endless adventure rv']",5.062011920925172,2.6483056568111247,167.2925,389764.4088058833,1.0007404246965514,1.5757903245607257
5,1_GGBMN5vIs,The ULTIMATE Camper Van Tour of KANSAS! Epic State Guide + Incredible Local Food!   RV Life USA,19,128541,7578,0,,2022-08-04 17:18:46+00:00,361057.91,1484,"['The Endless Adventure', 'Eric Bieller', 'Allison Bieller', 'rv life', 'kansas', 'things to do in kansas', 'kansas guide', 'the endless adventure rv', 'camper van']",0.025719540495517616,-0.10530579181855002,168.04861111111111,379681.4921392166,0.3385495544588417,-0.8739637903092536
6,FO8EQ6N7uag,Is This the End of RV Life?? - Back to Our Vintage Camper... But We Have a HUGE Problem! 😭,19,156747,9002,0,,2022-08-12 18:25:21+00:00,349471.33,946,"['The Endless Adventure', 'Eric Bieller', 'Allison Bieller', 'rv', 'rv life', 'the endless adventure rv', 'clementine rv', 'rv living', 'rv mistake']",0.5689208577673782,0.6636965033076819,193.10972222222222,368094.9088058833,0.42583311056513773,-0.5510610437716484
7,sD3kxdj56us,Full Tour of Our LUXURY Off-Road Travel Trailer RV!,19,205847,10112,0,,2022-08-29 17:40:48+00:00,325035.88,1668,"['The Endless Adventure', 'Eric Bieller', 'Allison Bieller', 'rv', 'luxury rv', 'blackseries', 'the endless adventure rv', 'travel trailer', 'tiny home', 'rv life']",1.5145063600735669,1.2631294721209667,407.2575,343659.4588058833,0.5989854046655909,0.08951037458616118
8,EAotmOmwv0c,Our Brand New RV Setup BROKE DOWN!? Are We Cursed??,19,176805,10551,0,,2022-09-05 15:20:45+00:00,315095.93,1007,"['The Endless Adventure', 'Eric Bieller', 'Allison Bieller', 'rv', 'rv life', 'the endless adventure rv', 'travel trailer', 'black series', 'rv breakdown']",0.9552050533938046,1.5002025111381125,165.66583333333332,333719.5088058833,0.5298012113006053,-0.16643435373513574
9,aK7zlYAa7BA,Our PERFECT RV Road Trip Across Michigan’s Upper Peninsula 😍 - The Ultimate Guide,19,202321,9879,0,,2022-09-12 18:59:31+00:00,304797.17,1501,"['The Endless Adventure', 'Eric Bieller', 'Allison Bieller', 'michigan', 'rv', 'rv life', 'the endless adventure rv', 'michigan guide', 'things to do in michigan']",1.4466013808244504,1.13730255164034,171.6461111111111,323420.7421392166,0.6255659382319728,0.18784421518458072
10,aytNOU7IbKU,Overnight RV Camping at a WALMART Parking Lot! - Super Sketchy 👀,19,294660,9935,0,,2022-09-19 14:41:53+00:00,294974.81,1114,"['The Endless Adventure', 'Eric Bieller', 'Allison Bieller', 'rv', 'rv camping', 'rv parking lot', 'rv walmart', 'the endless adventure rv']",3.224899134336694,1.1675442149318211,163.7061111111111,313598.37547255,0.9396094592517821,1.3496382574225305
11,xk7jt8H-rBY,We Traded Our 2022 Travel Trailer for a VINTAGE CAMPER VAN!   RV Swap with Travel Beans!,19,158423,7550,0,,2022-09-26 15:01:16+00:00,284875.42,1156,"['The Endless Adventure', 'Eric Bieller', 'Allison Bieller', 'travel beans', 'rv', 'the endless adventure rv', 'camper van', 'camper van swap']",0.6011978700253248,-0.12042662346429053,168.32305555555556,303498.9921392166,0.5219885538444573,-0.19533703211908532
12,6wMyGoTSpFo,We Had to Break Into OUR OWN RV! 😫 + Update on the Future of Clementine!,19,114651,7229,0,,2022-10-04 15:07:15+00:00,273349.44,1014,"['The Endless Adventure', 'Eric Bieller', 'Allison Bieller', 'rv', 'travel trailer', 'the endless adventure rv', 'clementine', 'camper van']",-0.24177908734629422,-0.2937761576886729,192.09972222222223,291973.0088058833,0.3926767082645818,-0.6737221021171277
13,Ajz5OfAi4_M,We’re Back to FULL-TIME RV Life! - Traveling to Our 8th US State: Indiana!,19,137758,7572,0,,2022-10-24 14:01:46+00:00,244614.93,1220,"['The Endless Adventure', 'Eric Bieller', 'Allison Bieller', 'rv', 'rv life', 'travel trailer', 'indiana', 'the endless adventure rv']",0.2032238495536875,-0.10854597002835156,478.9086111111111,263238.4921392167,0.5233201226785067,-0.190410935464696
14,G8wuD2_z2R8,How We RV Camp FOR FREE At Wineries & Farms! - Best Off-Grid Boondocking in Ohio 😍,19,90017,6429,0,,2022-10-30 19:32:05+00:00,235644.61,1050,"['The Endless Adventure', 'Eric Bieller', 'Allison Bieller', 'rv camping', 'free rv camping', 'rv boondocking', 'rv camping for free']",-0.716189540784393,-0.7257999189955447,149.5052777777778,254268.17547255,0.3540238562403888,-0.8167171018273108
15,Cp3K8FuN5wI,New York is INCREDIBLE! - Perfect Fall Colors RV Road Trip in The Finger Lakes 🍁,19,97492,6432,0,,2022-11-07 15:30:23+00:00,224366.32,1005,"['The Endless Adventure', 'Eric Bieller', 'Allison Bieller', 'rv', 'new york', 'the endless adventure rv', 'new york guide', 'finger lakes', 'upstate new york']",-0.5722332957795303,-0.724179829890644,187.97166666666666,242989.87547255,0.40121836274208655,-0.6421225223818267
16,12bvCbmwujA,Our ULTIMATE Road Trip in New York’s HUDSON VALLEY! Epic Guide + Delicious Local Food!   RV Life USA,19,111615,6756,0,,2022-11-11 18:56:07+00:00,218400.58,1466,"['The Endless Adventure', 'Eric Bieller', 'Allison Bieller', 'hudson valley', 'hudson valley guide', 'new york', 'new york guide', 'new york rv', 'the endless adventure new york', 'new york road trip', 'top things to do in hudson valley']",-0.3002474699328846,-0.5492102065613609,99.42888888888889,237024.14213921668,0.4709013984509758,-0.3843323426362137
17,iKjP9P_0LmU,Overnight RV Camping in a Cracker Barrel PARKING LOT! - We’re Locked Out AGAIN!?,19,166815,8121,0,,2022-11-14 16:28:25+00:00,214228.29,949,"['The Endless Adventure', 'Eric Bieller', 'Allison Bieller', 'parking lot', 'rv camping', 'rv camping at cracker barrel', 'rv camping at walmart']",0.7628140316414863,0.18793033616848925,69.53833333333333,232851.84213921666,0.7163997435771422,0.5238809961413284
18,HoUkA_2PP4E,Our Crazy RV Road Trip Continues To VERMONT & NEW HAMPSHIRE!,19,115045,6462,0,,2022-11-21 15:19:54+00:00,204216.8,1342,"['The Endless Adventure', 'Eric Bieller', 'Allison Bieller', 'rv', 'rv camping', 'rv road trip', 'the endless adventure rv', 'vermont', 'new hampshire']",-0.23419129329520177,-0.7079789388416363,166.85805555555555,222840.35880588333,0.516266445703473,-0.2165057896392173
19,Q7aikVSo7o0,Full Tour of Our Renovated Luxury TINY HOUSE in Maine! - Crazy Before & After 😍,19,114121,7455,0,,2022-11-26 17:37:35+00:00,196879.12,931,"['The Endless Adventure', 'Eric Bieller', 'Allison Bieller', 'tiny home', 'tiny house', 'the endless adventure tiny house', 'tiny house tour', 'luxury', 'luxury tiny house']",-0.25198601843025104,-0.17172944511948157,122.29472222222222,215502.67547255,0.5295572305529744,-0.16733695277012883
20,LirXGX_V5Us,We’re Vanlifers Now!? - Trading Our Travel Trailer for a 1987 VW CAMPER VAN! (Maine),19,114662,7021,0,,2022-12-02 16:23:12+00:00,188313.51,1211,"['The Endless Adventure', 'Eric Bieller', 'Allison Bieller', 'camper van', 'vw bus', 'westfalia', 'camper van tour', 'vw van tour', 'the endless adventure rv', 'vintage camper van']",-0.24156724538040078,-0.40610233562845954,142.7602777777778,206937.05880588334,0.5540911843516552,-0.07657436908972726
21,1UrydDBItwk,Winter Vanlife is TOUGH! - Exploring Maine in Below Freezing Temperatures 🥶,19,122475,7123,0,,2022-12-06 20:29:07+00:00,182307.59,1188,"['The Endless Adventure', 'Eric Bieller', 'Allison Bieller', 'camper van', 'vw bus', 'vw van', 'westfalia', 'rv', 'endless adventure rv']",-0.09110167451444859,-0.3510193060618334,100.09861111111111,200931.14213921668,0.6095371712720483,0.1285463003669522
22,aeUxGn3c2q8,What’s Going On With Our VINTAGE RV?? Huge Update + An Animal Broke In!,19,117155,7781,0,,2022-12-09 18:22:41+00:00,178114.03,1079,"['The Endless Adventure', 'Eric Bieller', 'Allison Bieller', 'rv renovation', 'rv living', 'full time rv', 'the endless adventure rv', 'vintage rv', 'clementine rv']",-0.19355615256473216,0.004320237613068718,69.89277777777778,196737.57547255,0.5954886844498405,0.07657436908972684
23,1UNths0W7d0,Should We Quit RV Life?? - Our Thoughts After 4 Months Living FULL-TIME!,19,116687,7095,0,,2022-12-16 18:27:26+00:00,168029.29,1303,"['The Endless Adventure', 'Eric Bieller', 'Allison Bieller', 'Mens jeans', 'mens pants', 'DUER', 'comfortable jeans', 'stretchy jeans', 'rv', 'rv life', 'full-time rv', 'the endless adventure rv', 'camper van', 'rv lifestyle', 'rv living', 'full time rving', 'full time rv']",-0.2025690652954714,-0.3661401377075739,168.07916666666668,186652.82547255,0.6251552833694474,0.18632501054966638
24,EIIel-d4sZk,Traveling by RV to 4 STATES IN 4 DAYS!? - Everything to SEE and EAT in New England!,19,108827,6630,0,,2022-12-19 18:02:44+00:00,163733.99,1351,"['The Endless Adventure', 'Eric Bieller', 'Allison Bieller', 'rv', 'rv life', 'new england', 'new england road trip', 'best new england states', 'what to do in new england', 'massachusetts', 'rhode island', 'Connecticut']",-0.3539397791066047,-0.6172539489671932,71.58833333333334,182357.52547255,0.5967782229880145,0.081344975998036
25,FwMHCjmiXN4,Our PERFECT Day in Philadelphia! Cheesesteak SHOWDOWN  Delicious Local Food Tour & More! 🤤,19,116243,6768,0,,2022-12-27 18:04:42+00:00,152212.02,1003,"['The Endless Adventure', 'Eric Bieller', 'Allison Bieller', 'philadelphia', 'philadelphia guide', 'things to do in philadelphia', 'philadelphia foods', 'what to eat in philadelphia', 'Philadelphia food tour', 'Philadelphia guide', 'philly cheesesteak']",-0.21111977737335222,-0.5427298501417578,192.03277777777777,170835.55880588334,0.6804379650965074,0.39084153762485435
26,A8CuWbVqU8w,First Time RV Camping at a Rest Stop Parking Lot! - Electrical Issues And a Horrible Nights Sleep 😭,19,239876,8796,0,,2023-01-02 17:52:31+00:00,143584.21,870,"['The Endless Adventure', 'Eric Bieller', 'Allison Bieller', 'rv', 'parking lot', 'parking lot camping', 'rv boondocking', 'rv rest stop']",2.1698491107452025,0.5524503847711624,143.79694444444445,162207.74213921666,1.4788196718386208,3.344429331165881
27,tIg6mStZiP8,We FINALLY Got Our Vintage Camper Van Back! - But Does It Actually Run??,19,166288,9523,0,,2023-03-13 17:28:00+00:00,42808.73,1209,"['The Endless Adventure', 'Eric Bieller', 'Allison Bieller', 'rv life', 'the endless adventure rv', 'rv renovation']",0.7526648756391369,0.9450519778587823,1679.5913888888888,61432.258805883335,2.706851469118936,7.887494002985801
28,nhmc0yUjwVw,Are We Renovating Our RV AGAIN?? - Making Some MUCH NEEDED Improvements!,19,95068,7765,0,,2023-03-19 19:31:40+00:00,34045.06,976,"['The Endless Adventure', 'Eric Bieller', 'Allison Bieller', 'rv', 'camper van', 'rv renovation', 'renovation', 'custom rv', 'the endless adventure rv']",-0.6189155617182309,-0.004320237613068718,146.0611111111111,52668.59213921667,1.8050226166803691,4.551206776046562
29,qNrE6ZTpN3s,It’s Happening 😱 We’re Back to FULL-TIME RV Life! - Moving Back Into Our Vintage Camper Van!,19,144876,8809,0,,2023-04-08 14:43:21+00:00,5533.38,1207,"['The Endless Adventure', 'Allison Bieller', 'rv life', 'vintage rv', 'camper van', 'van life', 'vintage rv renovation', 'rv living', 'rv', 'rv living full time']",0.3403048598472812,0.559470770892399,475.1947222222222,24156.908805883333,5.997290512795907,20.060368848093358
