,id,title,category_id,views,likes,favorites,comments,date,duration,tags
0,g8C3xcpvn-I,常連が殺到する大衆町中華職人の耳でも旨いリズミカルな鍋さばき丨Egg Fried Rice - Wok Skills in Japan,19,17346624,77088,0,NaN,2021-11-27T08:30:05Z,1639,"['うどん', 'そば', 'うどんそば', '饂飩', '蕎麦', '大阪', '奈良', 'うどんそば大阪奈良', '大阪グルメ', '奈良グルメ', 'udon', 'soba', 'udonsoba', '우동', '소바', '일본 우동소바', '乌冬面', '乌龙面', '荞麦面', '烏龍麵', '蕎麥麵', 'ちゃんぽん', '焼きそば', 'ヤキメシ', 'チャーハン', '酢豚', '定食', '町中華', '中華料理', '豊崎飯店', '大阪市北区豊崎']"
1,atHand8G7wA,濁流玉子のデカ盛り天津炒飯！！豪快かつ丁寧な職人鍋ふりが光る町中華  Egg Fried Rice &   Egg Yakisoba-Wok Skills In Osaka,19,1229907,5966,0,NaN,2021-12-01T08:30:00Z,949,"['うどん', 'そば', 'うどんそば', '饂飩', '蕎麦', '大阪', '奈良', 'うどんそば大阪奈良', '大阪グルメ', '奈良グルメ', 'udon', 'soba', 'udonsoba', '우동', '소바', '일본 우동소바', '乌冬面', '乌龙面', '荞麦面', '烏龍麵', '蕎麥麵', '天津炒飯', '焼きそば', '餃子', '麻婆豆腐', '町中華', '中華料理', '蓬珉軒', '大阪市阿倍野区昭和町']"
2,0_gL-Fdv3jo,焼めし爆弾！信じられない高速鍋さばきが炸裂する最強町中華   Egg Fried Rice - Wok Skills in Japan,19,18124863,47524,0,NaN,2021-12-05T08:30:00Z,1331,"['うどん', 'そば', 'うどんそば', '饂飩', '蕎麦', '大阪', '奈良', 'うどんそば大阪奈良', '大阪グルメ', '奈良グルメ', 'udon', 'soba', 'udonsoba', '우동', '소바', '일본 우동소바', '乌冬面', '乌龙面', '荞麦面', '烏龍麵', '蕎麥麵', '酢豚', '焼めし', '定食', '中華', '町中華', '天六', '十八番', '大阪市北区天神橋', 'friedrice', '볶음밥', 'FriedRice', '炒飯', 'Egg Fried Rice', 'Wok Skills in Japan']"
3,2DEl8dHtVIY,特大焼きめし鍋振り！常連が殺到するおばあちゃんと孫の大衆町中華丨Egg Fried Rice - Wok Skills in Japan,19,5840237,35285,0,NaN,2021-12-30T01:00:01Z,1742,"['うどん', 'そば', 'うどんそば', '饂飩', '蕎麦', '大阪', '奈良', 'うどんそば大阪奈良', '大阪グルメ', '奈良グルメ', 'udon', 'soba', 'udonsoba', '우동', '소바', '일본 우동소바', '乌冬面', '乌龙面', '荞麦面', '烏龍麵', '蕎麥麵', '中華料理', '町中華', '焼き飯', '唐揚げ', '餃子', '焼きそば', '若水', '大阪市西区江戸堀', '肥後橋駅', 'Chinesefood', '중국집']"
4,XtOH6Z54MZc,達人の領域まで極められた町中華職人のスキの無い鍋さばき丨Egg Fried Rice - Wok Skills in Japan,19,338330,2631,0,NaN,2022-02-12T08:00:11Z,518,"['うどん', 'そば', 'うどんそば', '饂飩', '蕎麦', '大阪', '奈良', 'うどんそば大阪奈良', '大阪グルメ', '奈良グルメ', 'udon', 'soba', 'udonsoba', '우동', '소바', '일본 우동소바', '乌冬面', '乌龙面', '荞麦面', '烏龍麵', '蕎麥麵']"
5,fM9H-LjyYVU,音でも旨い熟練鍋さばき！鮮やかな手際で魅せるチャーハン職人   Egg Fried Rice - Wok Skills in Japan,19,134415,1084,0,NaN,2022-03-01T08:00:19Z,846,"['うどん', 'そば', 'うどんそば', '饂飩', '蕎麦', '大阪', '奈良', 'うどんそば大阪奈良', '大阪グルメ', '奈良グルメ', 'udon', 'soba', 'udonsoba', '우동', '소바', '일본 우동소바', '乌冬面', '乌龙面', '荞麦面', '烏龍麵', '蕎麥麵']"
6,blqk53BN8BY,【大阪町中華４選】安くて美味しいならココ！鮮やかな手際でパパッと仕上げるボリューム満点焼めし丨Egg Fried Rice - Wok Skills in Japan,19,441126,2312,0,NaN,2022-03-03T09:30:10Z,1626,"['うどん', 'そば', 'うどんそば', '饂飩', '蕎麦', '大阪', '奈良', 'うどんそば大阪奈良', '大阪グルメ', '奈良グルメ', 'udon', 'soba', 'udonsoba', '우동', '소바', '일본 우동소바', '乌冬面', '乌龙面', '荞麦面', '烏龍麵', '蕎麥麵']"
7,s__DizklOHI,ちゃんぽんめん！皿うどん！和洋中何でもピカイチ旨い激渋な大衆町中華丨Egg Fried Rice - Wok Skills in Japan,19,306540,2161,0,NaN,2022-03-08T08:00:15Z,1763,"['うどん', 'そば', 'うどんそば', '饂飩', '蕎麦', '大阪', '奈良', 'うどんそば大阪奈良', '大阪グルメ', '奈良グルメ', 'udon', 'soba', 'udonsoba', '우동', '소바', '일본 우동소바', '乌冬面', '乌龙面', '荞麦面', '烏龍麵', '蕎麥麵']"
8,qK_TVnVkKWA,皿うどん！ちゃんぽん！大阪で驚異的な人気を誇る名店大衆中華の厨房に密着丨Sara Udon & Champon : Nagasaki ’s Famous Regional Dish,19,149013,1423,0,NaN,2022-03-13T08:30:07Z,1125,"['うどん', 'そば', 'うどんそば', '饂飩', '蕎麦', '大阪', '奈良', 'うどんそば大阪奈良', '大阪グルメ', '奈良グルメ', 'udon', 'soba', 'udonsoba', '우동', '소바', '일본 우동소바', '乌冬面', '乌龙面', '荞麦面', '烏龍麵', '蕎麥麵']"
9,agKJZQbCbTI,焼ちゃんぽん！目玉焼きチャーハン！豪快な鍋さばきが炸裂するガッツリ中華料理店の仕事丨Egg Fried Rice-Wok skills,19,139571,1181,0,NaN,2022-03-16T08:00:00Z,1130,"['うどん', 'そば', 'うどんそば', '饂飩', '蕎麦', '大阪', '奈良', 'うどんそば大阪奈良', '大阪グルメ', '奈良グルメ', 'udon', 'soba', 'udonsoba', '우동', '소바', '일본 우동소바', '乌冬面', '乌龙面', '荞麦面', '烏龍麵', '蕎麥麵']"
10,dnqZqHWhPls,熟練料理人のリズミカルな鍋さばき！ボリューム満点ガッツリ中華食堂の厨房仕事,19,74306,1014,0,NaN,2022-05-29T08:30:03Z,558,"['うどん', 'そば', 'うどんそば', '饂飩', '蕎麦', '大阪', '奈良', 'うどんそば大阪奈良', '大阪グルメ', '奈良グルメ', 'udon', 'soba', 'udonsoba', '우동', '소바', '일본 우동소바', '乌冬面', '乌龙面', '荞麦面', '烏龍麵', '蕎麥麵', '炒飯', '海鮮レタスチャーハン', '海鮮五目あんかけ焼そば', '焼きそば', '餃子', '肉肉餃子', '紅虎軒', '大阪府大阪市中央区心斎橋筋']"
11,ZpaEqKu4t1A,常連を虜にした鍋振り職人の熱旨グルメと町中華パワー溢れる名物女将さん,19,39983,656,0,NaN,2022-06-06T08:30:04Z,327,"['うどん', 'そば', 'うどんそば', '饂飩', '蕎麦', '大阪', '奈良', 'うどんそば大阪奈良', '大阪グルメ', '奈良グルメ', 'udon', 'soba', 'udonsoba', '우동', '소바', '일본 우동소바', '乌冬面', '乌龙面', '荞麦面', '烏龍麵', '蕎麥麵', '青椒肉絲', '牛肉とピーマン細切り炒め', '麻婆麺', '炒飯', 'カニレタスチャーハン', '龍華軒', '大阪府大阪市中央区材木町']"
12,fsZUPIWzuvE,速すぎ？！あっという間に注文をさばく高速鍋振り職人の大衆町中華丨Egg fried rice & Fried noodles,19,465787,2537,0,NaN,2022-06-16T08:30:05Z,1197,"['うどん', 'そば', 'うどんそば', '饂飩', '蕎麦', '大阪', '奈良', 'うどんそば大阪奈良', '大阪グルメ', '奈良グルメ', 'udon', 'soba', 'udonsoba', '우동', '소바', '일본 우동소바', '乌冬面', '乌龙面', '荞麦面', '烏龍麵', '蕎麥麵', '炒飯', '天津麺', 'やきそば', '富品', '大阪府大阪市中央区南船場']"
13,UrW-U6U3VTY,音でも旨い炒飯玉子！！鮮やかな職人鍋振りが炸裂する地元密着中華料理店の１日丨Wok Skills in Japan,19,1217341,6978,0,NaN,2022-07-24T08:30:04Z,2183,"['うどん', 'そば', 'うどんそば', '饂飩', '蕎麦', '大阪', '奈良', 'うどんそば大阪奈良', '大阪グルメ', '奈良グルメ', 'udon', 'soba', 'udonsoba', '우동', '소바', '일본 우동소바', '乌冬面', '乌龙面', '荞麦面', '烏龍麵', '蕎麥麵', '黒ごま冷麺', '麻婆オム丼', '中華上原', '町中華', '大阪府豊中市服部西町']"
14,tvZWFGScaXY,熟練のワンオペ炒飯鍋振り職人！信じられない最強ランチ６９０円に常連が殺到する町中華 丨Egg Fried Rice - Wok Skills in Japan,19,8549188,50982,0,NaN,2022-09-22T08:30:10Z,2765,"['うどん', 'そば', 'うどんそば', '饂飩', '蕎麦', '大阪', '奈良', 'うどんそば大阪奈良', '大阪グルメ', '奈良グルメ', 'udon', 'soba', 'udonsoba', '우동', '소바', '일본 우동소바', '乌冬面', '乌龙面', '荞麦面', '烏龍麵', '蕎麥麵', 'ニュー楼蘭', '大阪府寝屋川市池田新町', '天津ソース焼そば', '冷やし中華', 'オムライス']"
15,iDgkcMGJvQ8,炒飯！焼きそば！家族で営む本格町中華の朝の仕込みに密着丨Egg Fried Rice - Wok Skills in Japan,19,3020255,18600,0,NaN,2022-10-02T08:30:05Z,2828,"['うどん', 'そば', 'うどんそば', '饂飩', '蕎麦', '大阪', '奈良', 'うどんそば大阪奈良', '大阪グルメ', '奈良グルメ', 'udon', 'soba', 'udonsoba', '우동', '소바', '일본 우동소바', '乌冬面', '乌龙面', '荞麦面', '烏龍麵', '蕎麥麵', '民生', '大阪府寝屋川市萱島信和町', '古老肉', '酢豚', '炒麺', 'あんかけ焼きそば', '楊州炒飯', '五目焼き飯']"
16,4B7Fd9LHtic,最高コスパ中華料理店の爆売れ海老天玉子丼と大阪ならではの麻婆豆腐丨Chinese Restaurants in Osaka,19,160231,1689,0,NaN,2022-11-27T08:30:00Z,1630,"['うどん', 'そば', 'うどんそば', '饂飩', '蕎麦', '大阪', '奈良', 'うどんそば大阪奈良', '大阪グルメ', '奈良グルメ', 'udon', 'soba', 'udonsoba', '우동', '소바', '일본 우동소바', '乌冬面', '乌龙面', '荞麦面', '烏龍麵', '蕎麥麵', '黒龍天神樓', '大阪府大阪市北区天神橋', '坦々麺', '麻婆豆腐丼']"
17,cpsRtEUJX0M,真っ暗な田んぼ道にポツンと激シブ大衆町中華！密着したらまさかの衝撃グルメが満載だった丨Japanese Good Old Diner,19,649330,4831,0,NaN,2022-12-01T08:30:05Z,2004,"['うどん', 'そば', 'うどんそば', '饂飩', '蕎麦', '大阪', '奈良', 'うどんそば大阪奈良', '大阪グルメ', '奈良グルメ', 'udon', 'soba', 'udonsoba', '우동', '소바', '일본 우동소바', '乌冬面', '乌龙面', '荞麦面', '烏龍麵', '蕎麥麵', '新中華花林', '奈良県橿原市寺田町', 'やきそば（広東）', 'こだわり卵の天津飯']"
18,X1Alc4SUqLU,凄まじい爆食いアニキ達が殺到する鬼盛りからあげ町中華に密着！丨Egg Fried Rice - Wok Skills In Japan,19,14648364,83799,0,NaN,2022-12-22T08:30:08Z,2651,"['うどん', 'そば', 'うどんそば', '饂飩', '蕎麦', '大阪', '奈良', 'うどんそば大阪奈良', '大阪グルメ', '奈良グルメ', 'udon', 'soba', 'udonsoba', '우동', '소바', '일본 우동소바', '乌冬面', '乌龙面', '荞麦面', '烏龍麵', '蕎麥麵', 'らーめんコーさん', '大阪市大正区千島', 'らーめん', 'からあげ', '炒飯']"
19,zwhMD8QzVBI,奈良）ガテン系職人爆食いアニキ達を支えるガッツリ男めし町中華に密着！丨Egg Fried Rice - Wok Skills In Japan,19,1361939,6516,0,NaN,2022-12-30T08:30:10Z,4499,"['うどん', 'そば', 'うどんそば', '饂飩', '蕎麦', '大阪', '奈良', 'うどんそば大阪奈良', '大阪グルメ', '奈良グルメ', 'udon', 'soba', 'udonsoba', '우동', '소바', '일본 우동소바', '乌冬面', '乌龙面', '荞麦面', '烏龍麵', '蕎麥麵', 'yt:cc=on', '中華飯店', '奈良県橿原市新堂町', '五目あんかけ焼きそば', '焼き飯', 'からあげ', '豚肉とニラの玉子炒め']"
20,oC6VAgWbI04,炒飯！ラーメン！鮮やかな爆速鍋振りが炸裂する深夜の行列町中華丨Egg Fried Rice - Wok Skills in Japan,19,140234,1419,0,NaN,2023-03-19T08:30:18Z,1268,"['うどん', 'そば', 'うどんそば', '饂飩', '蕎麦', '大阪', '奈良', 'うどんそば大阪奈良', '大阪グルメ', '奈良グルメ', 'udon', 'soba', 'udonsoba', '우동', '소바', '일본 우동소바', '乌冬面', '乌龙面', '荞麦面', '烏龍麵', '蕎麥麵', 'yt:cc=on', 'かどや麺', 'えびのマヨネーズソース', '焼き飯', 'かどや飯店', '大阪府池田市空港']"
21,YzYq1azoVe0,信じられない炒飯ラッシュ！ガッツリ町中華の注文が殺到する爆売れ男飯ランチ丨Egg Fried Rice - Wok Skills In Japan,19,802865,2680,0,NaN,2023-03-26T08:30:07Z,2390,"['うどん', 'そば', 'うどんそば', '饂飩', '蕎麦', '大阪', '奈良', 'うどんそば大阪奈良', '大阪グルメ', '奈良グルメ', 'udon', 'soba', 'udonsoba', '우동', '소바', '일본 우동소바', '乌冬面', '乌龙面', '荞麦面', '烏龍麵', '蕎麥麵', 'yt:cc=on', '炒飯', '酢豚', 'エビマヨ', '北京料理 龍', '大阪府大阪市浪速区桜川']"
22,h3yIGelqkeI,鮮やかな爆速チャーハン鍋さばき！サラリーマンO L働く人々を支えるスピード本格中華丨Egg Fried Rice - Wok Skills in Japan,19,161907,1327,0,NaN,2023-04-02T08:30:11Z,3394,"['うどん', 'そば', 'うどんそば', '饂飩', '蕎麦', '大阪', '奈良', 'うどんそば大阪奈良', '大阪グルメ', '奈良グルメ', 'udon', 'soba', 'udonsoba', '우동', '소바', '일본 우동소바', '乌冬面', '乌龙面', '荞麦面', '烏龍麵', '蕎麥麵', 'yt:cc=on', '黒酢酢豚', '飛天チャンポン麺', 'チャーハン', 'チャイナダイニング', '飛天', '奈良県奈良市東向南町']"
23,MPcnCfGK0Wo,驚異的な超絶炒飯ラッシュ！行列ができる大衆町中華の朝の仕込みに密着丨Egg Fried Rice - Wok Skills in Japan,19,413314,2330,0,NaN,2023-04-09T08:30:07Z,2859,"['うどん', 'そば', 'うどんそば', '饂飩', '蕎麦', '大阪', '奈良', 'うどんそば大阪奈良', '大阪グルメ', '奈良グルメ', 'udon', 'soba', 'udonsoba', '우동', '소바', '일본 우동소바', '乌冬面', '乌龙面', '荞麦面', '烏龍麵', '蕎麥麵', 'yt:cc=on', '炒飯', '八宝菜', '南海飯店', '大阪府大阪市天王寺区上本町', '担々麺']"
