,id,title,category_id,views,likes,favorites,comments,date,date_gap,duration,tags
0,PXbqG0BY6E4,Shipping My Motorcycle to INDIA from DUBAI EP.01   INDIA Motorcycle Tour,19,556189,43874,0,NaN,2023-04-01T14:21:26Z,238.38,1220,NaN
1,MzwVnUBCip4,Landed in INDIA 🇮🇳 EP.02   250$ Fine and Immigration Process   Pakistani on Indian Tour,19,1747375,68602,0,NaN,2023-04-02T14:00:42Z,214.73,1363,NaN
2,elj2UyGCQ3E,First DAY IN INDIA  🇮🇳 and Customs Clearance of my Motorcycle EP.03   Pakistani on Indian Tour,19,1562530,77303,0,NaN,2023-04-03T14:10:02Z,190.57,1683,NaN
3,6ap6nGWpAIs,Spectacular Backwaters of Kerala INDIA 🇮🇳 EP.04   God's Own Country   Pakistani on Indian Tour,19,961904,59944,0,NaN,2023-04-05T14:13:00Z,142.52,1958,NaN
4,QklIINnTT2w,Didn't EXPECT to See this in Kerala INDIA 🇮🇳 EP.05   God's Own Country   Pakistani on Indian Tour,19,824181,48233,0,NaN,2023-04-06T14:13:17Z,118.52,1725,NaN
5,H7TGIW8Tu2k,Incredible Tea Plantations on Rolling Hills in Munnar Kerala 🇮🇳 EP.06   Pakistani on Indian Tour,19,691764,36280,0,NaN,2023-04-07T14:16:46Z,94.46,1055,NaN
6,5cvt6MxiAT0,Most UNEXPECTED & SURPRISING RIDE in Kerala 🇮🇳 EP.07   Pakistani on Indian Tour,19,599859,38770,0,NaN,2023-04-08T15:02:32Z,69.7,1561,NaN
7,AnYvq0378tQ,Jungle mein Raat ke 2 bajy Tire Puncture ho gya 🇮🇳 EP.09   Pakistani on Indian Tour,19,331153,27518,0,NaN,2023-04-10T14:50:22Z,21.9,779,NaN
