,title,category_id,views,likes,favorites,comments,date,tags
0,나는 인생에 혼돈을 겪을 때 히말라야를 올라간다 - 네팔(1),19,137131,4796,0,NaN,2022-10-05T03:01:11Z,NaN
1,혼자 4200m 베이스캠프에서 생활하는 23살 청년 - 네팔(2),19,370395,7744,0,NaN,2022-10-07T09:17:34Z,NaN
2,히말라야 트레킹에 미친 35살 총각 - 네팔(3),19,142205,5606,0,NaN,2022-10-10T02:52:14Z,NaN
3,안나푸르나 산을 오를수록 비싸지는 물가 - 네팔(4),19,131799,5269,0,NaN,2022-10-15T09:18:14Z,NaN
4,안나푸르나 베이스캠프에서 백숙 먹으러 가는 길 - 네팔(5),19,192761,6315,0,NaN,2022-10-17T07:24:52Z,NaN
5,안나푸르나 어느 산골 이자카야 닭튀김에 한잔 - 네팔(6),19,150889,5781,0,NaN,2022-10-21T08:13:57Z,NaN
6,밧심으로 안나푸르나 숨겨진 명소를 찾는 트레킹 - 네팔(7),19,128210,5441,0,NaN,2022-10-23T04:47:14Z,NaN
7,아파 죽겄는데 당신을 생각하며 걸었습니다 - 네팔(8),19,158164,5575,0,NaN,2022-10-25T07:27:24Z,NaN
8,억수로 비가 내리는 안나푸르나 산골에 고립 - 네팔(9),19,308811,7493,0,NaN,2022-10-28T08:19:33Z,NaN
9,한국식 삼겹살을 파는 3800m 히말라야 산골마을 - 네팔(10),19,734471,11915,0,NaN,2022-10-30T09:01:28Z,NaN
10,눈 1m 쌓인 히말라야 5400m를 눈보라 뚫고 오르다 - 네팔(11),19,228596,7982,0,NaN,2022-11-02T08:50:51Z,NaN
11,히말라야 5000m 순백의 설산을 데굴데굴 탈출 - 네팔(12),19,166953,7164,0,NaN,2022-11-04T08:35:21Z,NaN
12,악바리 근성으로 히말라야 하루 51km 걷는 뷰티유튜버 - 네팔(13),19,145701,6949,0,NaN,2022-11-07T08:27:03Z,NaN
13,네팔의 지상낙원 포카라에서 힐링하기 - 네팔(14),19,182362,6901,0,NaN,2022-11-08T08:22:28Z,NaN
14,일본 낭만의 규슈올레길 도보여행 시작 - 규슈올레(1),19,176117,6985,0,NaN,2022-11-15T11:46:43Z,NaN
15,장어덮밥 먹고 불끈불끈 힘내서 일본 도보여행 - 규슈올레(2),19,120226,4877,0,NaN,2022-11-19T02:29:26Z,NaN
16,충격적인 일본 호스텔 가격 주말에 도미토리가 18만원 그래서 PC방에서 잠자기 - 규슈올레(3),19,238947,7518,0,NaN,2022-11-21T09:38:06Z,NaN
17,일본 모텔에서 편의점 8첩반상 먹고 올레길 걷기 - 규슈올레(4),19,157223,5900,0,NaN,2022-11-24T10:32:13Z,NaN
18,일본 올레길 걷고 이자카야에서 흥분적인 맥주 타임 - 규슈올레(5),19,127037,4998,0,NaN,2022-11-27T09:43:02Z,NaN
19,문제가 많은 일본 숙박 가격과 험난한 도보여행 - 규슈올레(6),19,147461,5212,0,NaN,2022-12-01T07:08:54Z,NaN
20,길바닥에서 자야 할 위기의 일본 도보여행 - 규슈올레(7),19,131050,5908,0,NaN,2022-12-04T09:48:30Z,NaN
21,1940년에 지어진 일본 전통 호텔에서 목욕하고 걷자 - 규슈올레(8),19,109518,5165,0,NaN,2022-12-06T08:03:25Z,NaN
22,‘일정식’ 두 번과 ‘온천’ 두 번 하며 걷는 일본 여행 - 규슈올레(9),19,121574,5182,0,NaN,2022-12-07T08:18:02Z,NaN
23,일본 올레길 걷고 짬뽕과 탕수육에 맥주 원샷 - 규슈올레(10),19,122003,5438,0,NaN,2022-12-09T03:28:43Z,NaN
24,말고기를 파는 훌륭한 일본 기차역 - 규슈올레(11),19,98492,4618,0,NaN,2022-12-10T05:39:46Z,NaN
25,"10번의 호텔 방없음, 결국 ‘거기’에서 자는 일본 여행 - 규슈올레(12)",19,115191,5292,0,NaN,2022-12-12T08:12:39Z,NaN
26,구독자님 별장에서 잠시 휴식하며 등산과 온천 - 일본규슈(번외편),19,98593,4914,0,NaN,2022-12-14T08:56:13Z,NaN
27,어떻게 일본에서 싸고 낭만적이게 식사를 할 수 있을까 - 규슈올레(13),19,135162,5102,0,NaN,2022-12-16T07:50:57Z,NaN
28,야망있게 걷고 러브호텔에서 구독자 10만 기념 파티 - 규슈올레(14),19,138779,5664,0,NaN,2022-12-20T07:12:28Z,NaN
29,1인 여행자를 위한 일본의 신개념 호텔 - 규슈올레(15),19,111024,4642,0,NaN,2022-12-25T02:29:22Z,NaN
30,"온천이 있는 48인실 캡슐룸 하룻밤, 그리고 인생 튀김꼬치집 - 규슈올레(16)",19,108102,4838,0,NaN,2022-12-28T10:59:02Z,NaN
31,일본 이자카야 술값을 내주는 할아버지와 합석 - 규슈올레(17),19,134967,5658,0,NaN,2023-01-01T06:25:46Z,NaN
32,일본 밥이 무제한 공짜 PC방에서 규슈올레길 마무리 - 규슈올레(18),19,116526,5978,0,NaN,2023-01-04T09:21:21Z,NaN
33,영국 시골 기차역에서 하룻밤 자고 CTC 걷자 - 영국횡단(0),19,105877,5176,0,NaN,2023-01-21T03:05:39Z,NaN
34,영국 음식은 진짜 맛이 없을까? - 영국횡단(1),19,136377,7064,0,NaN,2023-01-24T08:48:55Z,NaN
35,영국 대자연을 걷고 깡시골 호텔에서 고급 식사 - 영국횡단(2),19,117774,6024,0,NaN,2023-01-27T08:16:40Z,NaN
36,충격적인 영국 물가 강제적 호캉스 - 영국횡단(3),19,110947,5606,0,NaN,2023-01-29T02:00:24Z,NaN
37,영국 시골 역대급 가성비 1위 호텔 - 영국횡단(4),19,115686,6193,0,NaN,2023-02-01T09:17:10Z,NaN
38,거대한 풍파속을 걷는 영국 도보여행 - 영국횡단(5),19,110934,6009,0,NaN,2023-02-05T08:09:50Z,NaN
39,길바닥 인생 4천원 VS 호텔과 식사 15만원 - 영국횡단(6),19,105679,5627,0,NaN,2023-02-07T08:27:40Z,NaN
40,영국 오지를 갈팡질팡 고생하고 식욕폭발 - 영국횡단(7),19,136333,7087,0,NaN,2023-02-10T09:20:30Z,NaN
41,24시간 1만칼로리 먹는 영국 도보여행 - 영국횡단(8),19,116840,6024,0,NaN,2023-02-12T03:00:15Z,NaN
42,전재산 여행에 올인하고 힘차게 걷는 남자 - 영국횡단(9),19,119525,7548,0,NaN,2023-02-16T08:42:26Z,NaN
43,36살 결혼 안하고 7년째 세계를 걷는 남자 - 영국횡단(10),19,266002,8926,0,NaN,2023-02-20T06:35:05Z,NaN
44,황량한 영국 대자연을 걷는 워킹머신 - 영국횡단(11),19,91487,5600,0,NaN,2023-02-23T06:55:50Z,NaN
45,강원도 촌놈의 영국 시골길 정복 완료 - 영국횡단(12),19,109727,7268,0,NaN,2023-02-27T07:16:59Z,NaN
46,영국 작은 해변마을에서 한식 먹기 대작전 🇬🇧,19,114333,6477,0,NaN,2023-03-02T09:12:45Z,NaN
47,영국에 30년째 정착한 한국인은 어떻게 살까 🇬🇧,19,277308,9421,0,NaN,2023-03-09T08:15:57Z,NaN
48,기막힌 더블린 힐튼호텔 첫경험 - 아일랜드(1),19,100902,5397,0,NaN,2023-03-12T03:00:04Z,NaN
49,도전을 허락하지 않는 위클로웨이 도보여행길 - 아일랜드(2),19,95802,6032,0,NaN,2023-03-17T08:58:13Z,NaN
50,갈증나게 44km 걷고 마시는 맥주는 얼마나 특별할까 - 독일Ⓡ(1),19,114389,6771,0,NaN,2023-03-19T02:48:48Z,NaN
51,사람 환장하게 만드는 소세지 강국 트레킹 - 독일Ⓡ(2),19,98108,6203,0,NaN,2023-03-21T07:59:54Z,NaN
52,꽃을 들고 말한테 가서 불을 지르고 걸어라 - 독일Ⓡ(3),19,97107,5463,0,NaN,2023-03-23T08:21:15Z,NaN
53,흥분되는 독일 마트식 물어뜯고 트레킹 - 독일Ⓡ(4),19,92609,4993,0,NaN,2023-03-27T06:33:03Z,NaN
54,뭔가 잘못된 독일 모텔에서 박살나는 하룻밤 - 독일Ⓡ(5),19,97286,5643,0,NaN,2023-03-29T10:11:42Z,NaN
